{
  "$schema": "./product-creation-template.schema.json",
  "kind": "product-creation-template",
  "template": {
    "id": "tea-product",
    "version": "1.0.0",
    "labels": {
      "en-US": "Tea",
      "ru-RU": "Чай"
    },
    "repositoryOnly": true,
    "profile": {
      "id": "tea",
      "version": "1.0.0"
    }
  },
  "runtime": {
    "service": "ProductCatalogService",
    "dataExchangeProfile": "products",
    "runtimeType": null,
    "definitionCreation": "disabled",
    "referenceResolution": "existing-code-only"
  },
  "source": {
    "system": "my.teadb.org",
    "identity": [
      "source.system",
      "source.externalId"
    ],
    "revisionRequired": true,
    "freshness": "record-source-controlled"
  },
  "catalog": {
    "catalogCode": "CATALOG-CHINESE-TEA",
    "categoryCode": null,
    "categoryRequired": true,
    "categoryResolution": "select-existing-code",
    "currency": "CNY"
  },
  "productFields": [
    {
      "path": "product.code",
      "type": "code",
      "required": true,
      "default": null,
      "editable": true
    },
    {
      "path": "product.sku",
      "type": "string",
      "required": false,
      "default": null,
      "editable": true
    },
    {
      "path": "product.nativeName",
      "type": "string",
      "required": false,
      "default": null,
      "editable": true
    },
    {
      "path": "product.transcription",
      "type": "string",
      "required": false,
      "default": null,
      "editable": true
    },
    {
      "path": "product.translations",
      "type": "localized-list",
      "required": true,
      "default": [],
      "editable": true
    },
    {
      "path": "product.catalogs",
      "type": "catalog-assignment-list",
      "required": true,
      "default": [],
      "editable": true
    },
    {
      "path": "product.published",
      "type": "boolean",
      "required": false,
      "default": false,
      "editable": true
    },
    {
      "path": "product.order",
      "type": "integer",
      "required": false,
      "default": 0,
      "editable": true
    },
    {
      "path": "product.brand",
      "type": "existing-code",
      "required": false,
      "default": null,
      "editable": true
    },
    {
      "path": "product.manufacturer",
      "type": "existing-code",
      "required": false,
      "default": null,
      "editable": true
    },
    {
      "path": "product.tags",
      "type": "existing-code-list",
      "required": false,
      "default": [],
      "editable": true
    },
    {
      "path": "product.packages",
      "type": "package-list",
      "required": false,
      "default": [],
      "editable": true
    },
    {
      "path": "product.origins",
      "type": "origin-list",
      "required": false,
      "default": [],
      "editable": true
    },
    {
      "path": "product.media",
      "type": "media-list",
      "required": false,
      "default": [],
      "editable": true
    },
    {
      "path": "product.catalogPrices",
      "type": "catalog-price-list",
      "required": false,
      "default": [],
      "editable": true
    },
    {
      "path": "product.tierPrices",
      "type": "tier-price-list",
      "required": false,
      "default": [],
      "editable": true
    },
    {
      "path": "product.related",
      "type": "product-reference-list",
      "required": false,
      "default": [],
      "editable": true
    },
    {
      "path": "product.crossSells",
      "type": "product-reference-list",
      "required": false,
      "default": [],
      "editable": true
    }
  ],
  "specifications": {
    "profileSource": "./profile.json",
    "requiredKeys": [],
    "defaults": [],
    "explicitAttributes": [
      {
        "key": "classification_origin.tea_type",
        "group": "classification_origin",
        "attributeCode": "SPEC-TT-CLASSIFICATION-ORIGIN-TEA-TYPE",
        "type": "Option",
        "required": false,
        "default": null,
        "sourcePaths": [
          "meta.tea_type"
        ],
        "activation": "value-present"
      },
      {
        "key": "source.category_code",
        "group": "source",
        "attributeCode": "SPEC-TT-SOURCE-CATEGORY-CODE",
        "type": "CustomText",
        "required": false,
        "default": null,
        "sourcePaths": [
          "meta.category_code"
        ],
        "activation": "value-present"
      },
      {
        "key": "atomic.oxidation",
        "group": "atomic",
        "attributeCode": "SPEC-TT-ATOMIC-OXIDATION",
        "type": "Range",
        "required": false,
        "default": null,
        "sourcePaths": [
          "meta.oxidation_min",
          "meta.oxidation_max"
        ],
        "activation": "value-present",
        "unit": "%"
      },
      {
        "key": "brewing.brew_temp",
        "group": "brewing",
        "attributeCode": "SPEC-TT-BREWING-BREW-TEMP",
        "type": "Range",
        "required": false,
        "default": null,
        "sourcePaths": [
          "meta.brew_temp_min",
          "meta.brew_temp_max"
        ],
        "activation": "value-present",
        "unit": "°C"
      },
      {
        "key": "atomic.shape",
        "group": "atomic",
        "attributeCode": "SPEC-TT-ATOMIC-SHAPE",
        "type": "Option",
        "required": false,
        "default": null,
        "sourcePaths": [
          "meta.shape",
          "sections.atomic.shape"
        ],
        "activation": "value-present"
      },
      {
        "key": "atomic.processing",
        "group": "atomic",
        "attributeCode": "SPEC-TT-ATOMIC-PROCESSING",
        "type": "Option",
        "required": false,
        "default": null,
        "sourcePaths": [
          "meta.processing",
          "sections.atomic.processing"
        ],
        "activation": "value-present"
      },
      {
        "key": "atomic.roast_level",
        "group": "atomic",
        "attributeCode": "SPEC-TT-ATOMIC-ROAST-LEVEL",
        "type": "Option",
        "required": false,
        "default": null,
        "sourcePaths": [
          "meta.roast_level",
          "sections.atomic.roast_level"
        ],
        "activation": "value-present"
      },
      {
        "key": "classification_origin.gi_status",
        "group": "classification_origin",
        "attributeCode": "SPEC-TT-CLASSIFICATION-ORIGIN-GI-STATUS",
        "type": "Boolean",
        "required": false,
        "default": null,
        "sourcePaths": [
          "meta.gi_status"
        ],
        "activation": "value-present"
      },
      {
        "key": "classification_origin.gi_standard",
        "group": "classification_origin",
        "attributeCode": "SPEC-TT-CLASSIFICATION-ORIGIN-GI-STANDARD",
        "type": "CustomText",
        "required": false,
        "default": null,
        "sourcePaths": [
          "meta.gi_standard"
        ],
        "activation": "value-present"
      },
      {
        "key": "organoleptic.taste",
        "group": "organoleptic",
        "attributeCode": "SPEC-TT-FIELD-ORGANOLEPTIC-TASTE",
        "type": "CustomText",
        "required": false,
        "default": null,
        "sourcePaths": [
          "sections.organoleptic.taste",
          "sections.sensory.taste"
        ],
        "activation": "value-present"
      },
      {
        "key": "organoleptic.liquor_aroma",
        "group": "organoleptic",
        "attributeCode": "SPEC-TT-FIELD-ORGANOLEPTIC-LIQUOR-AROMA",
        "type": "CustomText",
        "required": false,
        "default": null,
        "sourcePaths": [
          "sections.organoleptic.liquor_aroma"
        ],
        "activation": "value-present"
      },
      {
        "key": "organoleptic.dry_leaf_aroma",
        "group": "organoleptic",
        "attributeCode": "SPEC-TT-FIELD-ORGANOLEPTIC-DRY-LEAF-AROMA",
        "type": "CustomText",
        "required": false,
        "default": null,
        "sourcePaths": [
          "sections.organoleptic.dry_leaf_aroma"
        ],
        "activation": "value-present"
      },
      {
        "key": "organoleptic.liquor_color",
        "group": "organoleptic",
        "attributeCode": "SPEC-TT-FIELD-ORGANOLEPTIC-LIQUOR-COLOR",
        "type": "CustomText",
        "required": false,
        "default": null,
        "sourcePaths": [
          "sections.organoleptic.liquor_color"
        ],
        "activation": "value-present"
      },
      {
        "key": "organoleptic.spent_leaves",
        "group": "organoleptic",
        "attributeCode": "SPEC-TT-FIELD-ORGANOLEPTIC-SPENT-LEAVES",
        "type": "CustomText",
        "required": false,
        "default": null,
        "sourcePaths": [
          "sections.organoleptic.spent_leaves"
        ],
        "activation": "value-present"
      },
      {
        "key": "enrichment.flavor_tags",
        "group": "enrichment",
        "attributeCode": "SPEC-TT-ENRICHMENT-FLAVOR-TAGS",
        "type": "List",
        "required": false,
        "default": null,
        "sourcePaths": [
          "enrichment.flavor_tags"
        ],
        "activation": "value-present"
      },
      {
        "key": "enrichment.caffeine_level",
        "group": "enrichment",
        "attributeCode": "SPEC-TT-ENRICHMENT-CAFFEINE-LEVEL",
        "type": "Option",
        "required": false,
        "default": null,
        "sourcePaths": [
          "enrichment.caffeine_level"
        ],
        "activation": "value-present"
      },
      {
        "key": "enrichment.difficulty",
        "group": "enrichment",
        "attributeCode": "SPEC-TT-ENRICHMENT-DIFFICULTY",
        "type": "Option",
        "required": false,
        "default": null,
        "sourcePaths": [
          "enrichment.difficulty"
        ],
        "activation": "value-present"
      },
      {
        "key": "enrichment.price_tier",
        "group": "enrichment",
        "attributeCode": "SPEC-TT-ENRICHMENT-PRICE-TIER",
        "type": "Option",
        "required": false,
        "default": null,